created_at;id_str;full_text;quote_count;reply_count;retweet_count;favorite_count;lang;user_id_str;conversation_id_str;username;tweet_url
Sat Dec 30 13:25:06 +0000 2023;1741088019262972211;"kyk wethefest, trs solo concertnya bp, gda juga😭enggaaa aku ga ikut plss";0;0;0;0;in;1578028325217669121;1741087693176783076;piqnatelli;https://twitter.com/piqnatelli/status/1741088019262972211
Sat Dec 30 11:06:43 +0000 2023;1741053196582490149;"Jun: ke jogja sama annora jasmine adel Jul: nonton daniel caesar di wethefest Aug: apa ya, gua putus tp dibeliin bokap macbook baru kayanya, check in asrama i guess  Sep: ketemu temen-temen baru Oct: mixed feelings  Nov: accident Dec: eh kontol seru sih cm lebih banyak kontol nya";0;1;0;0;in;1364208242155352064;1740584127022424084;ndaalonica;https://twitter.com/ndaalonica/status/1741053196582490149
Fri Dec 29 21:02:01 +0000 2023;1740840619575234885;"Nonton @WeTheFest";0;0;0;0;en;77221797;1740840619575234885;jalbrahim23;https://twitter.com/jalbrahim23/status/1740840619575234885
Fri Dec 29 14:59:05 +0000 2023;1740749284625224092;"@ayilai We the fest thn brp lupa";0;1;0;0;in;33086996;1740743132004905355;nicksey;https://twitter.com/nicksey/status/1740749284625224092
Fri Dec 29 05:03:18 +0000 2023;1740599351007985670;"Pasar Musik, Raisa, Yerin Baek, IVE, Hindia, NIKI, We The Fest, Pestapora, Reality Club, Adhitia Sofyan, TWICE, dsb.";0;1;0;1;in;2758958943;1740599351007985670;dapurhangat;https://twitter.com/dapurhangat/status/1740599351007985670
Thu Dec 28 17:10:23 +0000 2023;1740419937326485956;"@dirawibi Ini we the fest kemarin yah";0;1;0;0;in;86064757;1740297143641055543;ammarghif;https://twitter.com/ammarghif/status/1740419937326485956
Thu Dec 28 14:00:29 +0000 2023;1740372150593437872;"Makes me wonder if I am being punished for something I dont realize I've done.  To be fair I've been to 4 major events (2 fieldtrips to Jogja &amp  Bandung respectively) &amp  2 festivals (WeTheFest &amp  Comifuro), I wonder if these exciting events come with losses to compensate for smthng";0;1;0;0;en;18886702;1740367335326888090;Ratryoshka;https://twitter.com/Ratryoshka/status/1740372150593437872
Thu Dec 28 09:46:18 +0000 2023;1740308182894063818;"01: promoted, amed trip 02: new home❤️ 03: men i trust 04: fam in bali 05: first 3K 06: gili air trip 07: we the fest + 5K milestone  08: mom + sister visit 09: singapore + batam + bintan trip 10: uh i hate talking about it 11: rethinking life choices + collier 12: IELTS";0;0;0;1;en;613213559;1740308182894063818;srimerdekawati_;https://twitter.com/srimerdekawati_/status/1740308182894063818
Wed Dec 27 17:41:51 +0000 2023;1740065468982174111;"jujur gua seneng bgt ngajakin adek gua wethefest (dadakan) kayak SIS… kakak lu tiap tahun wtfan dr 2017 and u belom pernah??? let me take u to this one… doi emg not really into this sih tp dia penggemar SO7 banget so lesgaurr https://t.co/y0L5IBlWAO";0;1;0;0;in;1100951863732498432;1737494741359423924;barbut_;https://twitter.com/barbut_/status/1740065468982174111
Wed Dec 27 12:17:02 +0000 2023;1739983726166351996;"🤍 things i remember in:  Jan: bandung &lt 3 Feb: first chat w kimi  Mar: my bday Apr: bukber &amp  lebaran!! May: biliard w frends Jun: java jazz w kimii Jul: we the fest!!!! Aug: fl momentss Sep: expoo!!  Oct: haha jd calon ketua Nov: COLDPLAAAYYY Dec: bbq niight!!";0;0;0;1;en;1579376582539739137;1739983726166351996;milkhoneysweett;https://twitter.com/milkhoneysweett/status/1739983726166351996
Wed Dec 27 11:07:27 +0000 2023;1739966216767483956;"Jan: jomblo Feb: jomblo Mar: jomblo Apr: jomblo kena tipu jual beli mobil May: jomblo minggat ke jakarta Jun: ultah Jul: we the fest Aug: jomblo Sep: jomblo Oct: nonton rex orange county Nov: ke thailand sama kl Dec: tetep jomblo";0;0;0;0;in;1102210924721582080;1739966216767483956;Adtysptr21;https://twitter.com/Adtysptr21/status/1739966216767483956
Wed Dec 27 08:46:32 +0000 2023;1739930753666781343;"Mintak pendapat rakan rakan. Festival di indo yg mana aku patut pi next year ? Pes por okay ka ? We the fest ? Dan lain lain ?";0;0;0;0;in;1313899417;1739930753666781343;adiikhwan__;https://twitter.com/adiikhwan__/status/1739930753666781343
Mon Dec 25 06:44:48 +0000 2023;1739175343708402007;"@KetemuOppa Concerts / Fan Meeting Event that I attended in 2023:  Jan: - Feb: - Mar: THE DREAM SHOW 2 in JKT Apr: - May: - Jun: WOODZ OOLI in JKT Jul: CXO Media Live on Stage Epik High, WE THE FEST Aug: - Sep: - Oct: - Nov: - Dec: LAZADA FEST RV&amp Key  #GiveawayKetemuOppa";0;0;0;0;en;501555400;1738937028887351748;marktheelixir;https://twitter.com/marktheelixir/status/1739175343708402007
Mon Dec 25 03:25:04 +0000 2023;1739125077961261271;"Beli vinyl Good Faith Madeon ✅ Nonton konser SUGA AGUST D ✅ (1/7 BTS, Bismillah OT7 soon) Beli MacBook Air M1 sksksksk ✅ Nonton Porter Robinson nawarin Nurture Live Set di We The Fest ✅  Alhamdulillah Ya Allah, MasyaAllah Tabarakallah 🙏 https://t.co/aP30qzOGCv";0;1;0;5;in;1341827067004907520;1739125077961261271;kingnyamjoon;https://twitter.com/kingnyamjoon/status/1739125077961261271
Mon Dec 25 03:09:43 +0000 2023;1739121215657414713;"Mar: winner the circle movie tp gpp May: the other fest Jul: wethefest Aug: FIBA world cup Sep: pestapora, nicole world tour Oct: richard marx  Dec: Lazada fest, RAN the sweet seventeen show";0;0;0;0;en;807849976864702465;1739121215657414713;pacifric;https://twitter.com/pacifric/status/1739121215657414713
Mon Dec 25 00:52:58 +0000 2023;1739086800688185573;"@bbyjimjams @yujinbean Yes it’s from after the wethefest performance in July with seungyeon. She’s posting these in order. https://t.co/w3FP4liWgv";0;2;0;1;en;934593027993161728;1739085178385936513;coloredseung;https://twitter.com/coloredseung/status/1739086800688185573
Sun Dec 24 23:08:42 +0000 2023;1739060558849306713;"Concerts / Music Events / Fan Meeting Event that you attended in 2023:  Feb: Itzy Checkmate May: pH-1 About Damn Time            Red Velvet R to V Jun: Woodz Oo-li Jul: We The Fest (Day1) Aug: ASS Vol.2 Sep: Twice Scarlett Dec: Twice Ready to Be  @doyzenniieee #GiveawayKetemuOppa";0;0;0;1;en;1346146756086489090;1739060558849306713;shoogkiie;https://twitter.com/shoogkiie/status/1739060558849306713
Sun Dec 24 22:52:44 +0000 2023;1739056541909606484;"Jul: Maroon 5, We The Fest Aug: Crush, Asian Sound Syndicate  Sep: NCT NATION (Japan), aespa Oct: -  Nov: Thee Sacred Souls Dec: Gemini, Tabber, Rad Museum  aaaand that concludes my 2023🤣 to more concerts and fun next year!🥂  #GiveawayKetemuOppa";0;0;0;0;en;719910164883578880;1739056539028029945;raw_rebel_root;https://twitter.com/raw_rebel_root/status/1739056541909606484
Sun Dec 24 17:07:31 +0000 2023;1738969667098829059;"Concerts / Music Events / Fan Meeting Event that you attended in 2023:  Jan:  Feb: ITZY CHECKMATE Mar: BP BORN PINK, Arctic Monkeys Apr: May: The Other Festival Jun: Jul: We The Fest Aug: ASS Vol. 2 Sep: NECKDEEP, ONE OK ROCK Oct: FLAVS Nov: Dec: Lazada Fest, TWICE Ready To Be";0;8;0;0;en;1639660310037684229;1738969667098829059;alastpoem;https://twitter.com/alastpoem/status/1738969667098829059
Sun Dec 24 16:24:22 +0000 2023;1738958806309355746;"We the fest, nah.";0;0;0;0;en;1067983047948066817;1738958806309355746;sumisamsudin;https://twitter.com/sumisamsudin/status/1738958806309355746
Sun Dec 24 15:42:28 +0000 2023;1738948263171281016;"@ruthythebear @ttmymoodb ayo jah we the fest 2024 pake itu";0;1;0;0;in;1705983277075775488;1738888045758382121;aIixend;https://twitter.com/aIixend/status/1738948263171281016
Sun Dec 24 15:03:56 +0000 2023;1738938566686966106;"@KetemuOppa Jan:- Feb:- Mar:Blackpink Apr:- May:Red Velvet Jun:Woodz, Aespa Jul:We the Fest Aug:Hwang Min Hyun Sep:- Oct:- Nov:- Dec:Twice  tag: @yeoldorado14 @dearalunaa   #GiveawayKetemuOppa";0;0;0;0;en;3275054738;1738937028887351748;theaugustsky;https://twitter.com/theaugustsky/status/1738938566686966106
Sun Dec 24 07:18:09 +0000 2023;1738821345495191963;"woodz ooli and in bangkok - inul gigi &amp  ungi @ prj fest - nassar (ft. cowo jawaku) we the fest 2023 - aldi taher (again ft. cowo jawaku) https://t.co/1oceuam82o";0;4;0;12;in;1077377593437868033;1738821345495191963;naonsiah_;https://twitter.com/naonsiah_/status/1738821345495191963
Fri Dec 22 15:08:44 +0000 2023;1738214998823067830;"@Sinta_Fatma @andre14s_ @Pratansyah @Arie_Kriting karena ga kamu kasih konteks, kaya kamu bilang WTF orang bakal mikir "what the f-" kalo kamu kasih konteks hiburan ya orang auto mikir "we the fest". kamu cari sgie islam di google udah auto muncul kok jawabannya.";0;1;0;4;in;1152183232152002561;1738205042199707836;jojobascent;https://twitter.com/jojobascent/status/1738214998823067830
Thu Dec 21 17:10:47 +0000 2023;1737883324964864509;"mengingat lagi, tahun ini lumayan juga nonton perkonseran  - mamamoo - blackpink - we the fest (sambil kerja) - se so neon (dpt tiket gratis round fest)  pengen nonton twice, tapi sadar nggak punya budget wkwk";0;0;0;0;in;1116677875;1737883324964864509;denywasawi;https://twitter.com/denywasawi/status/1737883324964864509
Wed Dec 20 13:36:13 +0000 2023;1737466937645715577;"@parkaeriiii Oh iyaa aku liat jg wktu di we the fest. Baguss diaaa";0;1;0;2;in;1369683320854908930;1737452890925723662;sushiboy_20;https://twitter.com/sushiboy_20/status/1737466937645715577
Wed Dec 20 12:22:06 +0000 2023;1737448287530287217;"@8eatopia we the fest";0;1;0;0;en;2757205731;1737447532576538649;oddyinnyc;https://twitter.com/oddyinnyc/status/1737448287530287217
Wed Dec 20 03:02:50 +0000 2023;1737307542865465478;"Menonton ulang semua live stage the strokes we the fest hanya agar dapat merasakan sesuatu";0;1;0;0;in;1269401077977243649;1737307542865465478;tmsn2303;https://twitter.com/tmsn2303/status/1737307542865465478
Tue Dec 19 09:07:02 +0000 2023;1737036806963749186;"this was from we the fest 23 in jakarta btw !! i was going thru my gallery and i didn't even realize she kkyu-ed 😭 https://t.co/HRCVldcEat";1;0;2;38;en;512856172;1737030820534300935;liebchenle;https://twitter.com/liebchenle/status/1737036806963749186
Tue Dec 19 07:54:47 +0000 2023;1737018626996388123;"@kolonigigs_ @SynchronizeFest &amp  @WeTheFest ✨✨ https://t.co/96GjplQ2hk";0;0;0;1;und;1060536788995858434;1736986158952018361;cleomepetrea;https://twitter.com/cleomepetrea/status/1737018626996388123
Tue Dec 19 06:21:32 +0000 2023;1736995158733021610;"@AW_CallieJKT48 @AW_CallieJKT48 biasanya langganan we the fest sih dia kell tapi sayang banget taun ini dia batalin semua tur asianyaa, ku doain supaya juga bisa nonton yahh!! 🫶🏻🫶🏻 ini ku kasi vidio pas 2019 maren dateng ke indo kell  #Callieanswer https://t.co/D9v4UQx3CB";0;1;0;0;in;1703827664732352512;1724130993454616846;prudiiiii_;https://twitter.com/prudiiiii_/status/1736995158733021610
Mon Dec 18 11:09:22 +0000 2023;1736705207357276492;"2024 saya ingin:  - membeli iPad Air  - buy AirPods again.. 🥲 - be more patient  - consistent workout - wethefest again with my friendssss - always healthy mind, body n soul - prioritizing my mom’s happiness  - semakin banyak sumber rezeki  i can feel 2024 it’s gonna be my year";0;2;0;8;en;1217308189529559040;1736705207357276492;boygenews;https://twitter.com/boygenews/status/1736705207357276492
Sun Dec 17 22:50:07 +0000 2023;1736519167472234913;"2 hari nonton Blackpink di GBK dan nonton Lee Hi di We The Fest. Enggak akan terlupakan... https://t.co/43n4FFCFes";0;0;0;0;in;73845163;1736519167472234913;wisnu_prasetya;https://twitter.com/wisnu_prasetya/status/1736519167472234913
Sun Dec 17 16:05:13 +0000 2023;1736417274461081661;"and july ofc (karena we the fest) but february was really something";0;0;0;0;en;1419702178327896068;1736416335394152746;exhalehao;https://twitter.com/exhalehao/status/1736417274461081661
Sun Dec 17 05:09:12 +0000 2023;1736252181979005195;"@WeTheFest tahun depan ada fred again dong please";0;0;0;0;in;983027105372946432;1736252181979005195;dutchydit;https://twitter.com/dutchydit/status/1736252181979005195
Fri Dec 15 19:03:04 +0000 2023;1735737256131039708;"I miss motret :( terakhir pake kamera pas wethefest wkwk";0;0;0;0;in;1368867277;1735736945152758120;teostival;https://twitter.com/teostival/status/1735737256131039708
Fri Dec 15 07:59:09 +0000 2023;1735570173577588763;"currently obsessed with omar apollo’s songs. wethefest undang dia dong thn depan 🥹🩷";0;0;0;0;en;4904199098;1735570173577588763;AdeliaCynthia12;https://twitter.com/AdeliaCynthia12/status/1735570173577588763
Fri Dec 15 07:33:31 +0000 2023;1735563721773383920;"@SFTC_ Gua bisa beli 2 kaos musisi di taun ini, dan juga dateng ke We The Fest 2023 untuk ngincer the 1975, tapi gajadi manggung gara2 Matty problematik, gantinya nonton Sheila on 7 &amp  Porter Robinson";0;0;0;1;in;3011321275;1735551006057046246;yusronell;https://twitter.com/yusronell/status/1735563721773383920
Thu Dec 14 13:50:09 +0000 2023;1735296118517547178;"@nayeonyny_s iya pas wethefest! jujur aku iri bgt sm org org😭😭 soalnya di pikiranku no one knows troye more that i do [tantrum lantaran troye sivan no #1 di spotify selama 5 tahun]";0;1;0;0;in;1653591473164812294;1735227065581044179;scyamane;https://twitter.com/scyamane/status/1735296118517547178
Thu Dec 14 12:01:58 +0000 2023;1735268895127441919;"tahun ini udah konser: 1. keshi 2. cigs aft sex 3. wethefest (batal si) 4. bruno major 5. vierra 6. twice scarlett 7. red velvet lazada 8. twice ready to be  kata gw si gws";0;0;0;0;in;1469545929636155392;1735268608518013074;noacflyn;https://twitter.com/noacflyn/status/1735268895127441919
Thu Dec 14 10:02:27 +0000 2023;1735238817232335198;"can't get over me not making it to We The Fest this year to see PORTER, DANIEL, ANDY  FUCKKKK";0;1;0;0;en;122631409;1735238817232335198;mangoojul;https://twitter.com/mangoojul/status/1735238817232335198
Thu Dec 14 04:57:43 +0000 2023;1735162128854876502;"Tadinya mau ku bales di Senayan, kak Ku kira We The Fest 🤣";0;1;0;0;in;97197603;1735162128854876502;outsidehitter_;https://twitter.com/outsidehitter_/status/1735162128854876502
Wed Dec 13 09:06:59 +0000 2023;1734862469204770886;"We the fest tahun depan undang paramore bisa lah ya";0;0;0;0;in;1558447308437565440;1734862469204770886;lupatertawa;https://twitter.com/lupatertawa/status/1734862469204770886
Wed Dec 13 09:04:40 +0000 2023;1734861887962288496;"my ultimate bucket-list for sal’s upcoming gigs on 2024:  ✮ prambanan jazz fest ✮ java jazz fest ✮ pestapora ✮ we the fest  aamiin aamiin aamiin, manifesting! siap war ticket semuanya❤️‍🔥🏁 https://t.co/Wd1fW3NTdu";2;11;36;396;en;1669377962515521537;1734861887962288496;noturmillie;https://twitter.com/noturmillie/status/1734861887962288496
Tue Dec 12 08:18:56 +0000 2023;1734487988464415196;"@ofjangkiy What the fxk? We the fest?";0;1;0;0;en;2757618868;1734472179230900499;lilbunniys;https://twitter.com/lilbunniys/status/1734487988464415196
Sat Dec 09 17:03:30 +0000 2023;1733532835942965417;"We The Fest 2018, ini konser festival pertama yang gue datengin. wkt itu artisnya James Bay, langsung gaabis pikir lg beli trus beli ditemen dapet harga 250 untuk 1 hari LGSG SENENG BGTTTT, trus nangis brutal sih dengerin james bay nyanyi huhu soalnya nostalgic bgt....";0;0;0;0;in;1477498748792045569;1733525244953116804;notcalestya;https://twitter.com/notcalestya/status/1733532835942965417
Sat Dec 09 15:18:11 +0000 2023;1733506331821449682;"imi di we the fest apa imi di asian sound syndicate mari kita buka kelas diskusi malam ini";0;2;0;1;in;1114138070;1733506331821449682;buzzerjookyun;https://twitter.com/buzzerjookyun/status/1733506331821449682
Fri Dec 08 17:20:26 +0000 2023;1733174709511209310;"PENTING banget.  kayak DWP We The Fest A.S.S  apalagi acara acara festival?  orang2 tuh selalu nungguin acara kayak gini karena brandingnya udah kuat   LAH ELU branding gak kuat tapi ngulang dari 0 mulu. gimana mau sukses acara nya";0;1;0;0;in;1291198099617062913;1733116494169719259;wedokbetawi;https://twitter.com/wedokbetawi/status/1733174709511209310
Fri Dec 08 04:41:45 +0000 2023;1732983783455170720;"Kek ngapain wen wen biarlah warga sana dikasih makan halu aja dengan subunit kesayangan. Tapi di satu sisi seneng juga dia ada jadwal di luar negeri as a soloist. Tahun depan abis comeback ke We the fest sini ya wen kaya lee hi";0;0;0;0;in;1323066021842878464;1732983783455170720;blueismycolor11;https://twitter.com/blueismycolor11/status/1732983783455170720
Thu Dec 07 14:13:11 +0000 2023;1732765200745382210;"matty should have dated gabbriette earlier so she could knock some sense into his head  told him not to cause any problems on their malay show so they could perform in wethefest";0;0;0;1;en;1469545929636155392;1732765200745382210;noacflyn;https://twitter.com/noacflyn/status/1732765200745382210
Thu Dec 07 11:06:36 +0000 2023;1732718245042614521;"Midnight play : Diskoria on We The Fest  Beuuh enak pisan, infokan lantai dansa om 😩 https://t.co/GHJoGiElnc";0;0;0;0;in;1461378170;1732718245042614521;goodisssue;https://twitter.com/goodisssue/status/1732718245042614521
Thu Dec 07 10:54:35 +0000 2023;1732715220496470387;"+ we the fest, coldplay, taylor, bts&amp got7 yg dulu";0;1;0;0;en;1182310663764377601;1732714974177554456;jcnozen;https://twitter.com/jcnozen/status/1732715220496470387
Thu Dec 07 09:21:44 +0000 2023;1732691852850262164;"@pikokrawkest Ohiye kalo di we the fest ada sarahdeshita di rawamangun ada bu enggah! Wih kapan tuh bang kok nanti gue ajak ini kali yak Salah satu musisi rawamangun kita yang msh aktif @akbar_hilwani :))";0;1;0;0;in;984082580667416577;1732685023122530448;ihvdthwish_;https://twitter.com/ihvdthwish_/status/1732691852850262164
Wed Dec 06 17:38:53 +0000 2023;1732454578250203405;"pulang ke jkt dari tamel bawa koper soalnya bingung mau pake apa buat we the fest";0;0;0;1;in;1155432530515877889;1732454578250203405;hydrococko;https://twitter.com/hydrococko/status/1732454578250203405
Wed Dec 06 11:07:43 +0000 2023;1732356139248243129;"pas war early entry tiket we the fest wtf dpt antrian 200 https://t.co/kzlOnZEJjN";0;1;0;0;en;206941973;1732344318273429613;iratheresia_;https://twitter.com/iratheresia_/status/1732356139248243129
Wed Dec 06 10:56:28 +0000 2023;1732353307614883887;"2024 we the fest line up nya siapa yahhhhhhh, the cure the cure atuhh euyyyyyy";0;0;0;0;in;536049355;1732353307614883887;ryandioandika;https://twitter.com/ryandioandika/status/1732353307614883887
Tue Dec 05 14:43:33 +0000 2023;1732048064641413371;"B.I HIDDEN TOUR JAKARTA BP BORNPINK TOUR JAKARTA LEE HI WETHEFEST DAY 1  TAEYEON ODE TOUR JAKARTA iKON TAKEOFF TOUR JAKARTA  ALLLLLLL THE BESTTTTTTT CONCERTTTTTTT!!! DONT ASK ME TO CHOOSEEEEEEE !!! they all differennt";0;1;0;1;en;1333763368423866374;1732048064641413371;Koovelly;https://twitter.com/Koovelly/status/1732048064641413371
Tue Dec 05 14:39:04 +0000 2023;1732046938173055202;"@secretlifeofhr we the fest kan mksdnya";0;0;0;0;in;1450504840753209347;1732046274244047167;lustycrav;https://twitter.com/lustycrav/status/1732046938173055202
Tue Dec 05 14:02:09 +0000 2023;1732037647256969441;"@w2e___ anjing bener bgt gue ke daniel caesar😐😐😐😐😐 we the fest mulu kapn solo";0;0;0;0;in;1664872774559748096;1732007656380928040;wareeruu;https://twitter.com/wareeruu/status/1732037647256969441
Tue Dec 05 13:10:51 +0000 2023;1732024736845324445;"We The Fest 2019 - 2 Day Pass, under 1,5jt. Dean depan mata. Bestttttt soalnya setelah ini dia ngilang 😜 https://t.co/ENEEIZwzul";1;0;0;0;in;1513891499439763459;1732023121576861776;artemiscatto;https://twitter.com/artemiscatto/status/1732024736845324445
Tue Dec 05 02:01:13 +0000 2023;1731856218497663343;"@jek___ @sulthonmys @ErlingHaaland @fifa @UEFAcom wtf itu We The Fest tads..";0;0;0;0;en;98823722;1731387201622004197;AnashChan;https://twitter.com/AnashChan/status/1731856218497663343
Tue Dec 05 00:33:06 +0000 2023;1731834041283072113;"@ErlingHaaland We The Fest";0;0;0;0;en;1697198949348847616;1731657504927477788;IniHiruma;https://twitter.com/IniHiruma/status/1731834041283072113
Mon Dec 04 16:03:22 +0000 2023;1731705764463673649;"Padahal kan maksudnya we the fest";0;4;3;72;in;137349848;1731705764463673649;panjiraden;https://twitter.com/panjiraden/status/1731705764463673649
Mon Dec 04 15:15:30 +0000 2023;1731693716975296621;"mungkin wtf yang dimaksud bang paland ini we the fest";0;0;0;0;in;249505481;1731693716975296621;dwirahayuks;https://twitter.com/dwirahayuks/status/1731693716975296621
